title,company,location,link
Senior Network/Cloud Engineer,"JPMorgan Chase Bank, N.A.","Tampa, FL",https://stackoverflow.com/jobs/539690
Data-/Machine-Learning Engineer,ti&m AG,"Zürich, Schweiz",https://stackoverflow.com/jobs/522401
Data Architect mit einem Flair für AI,ti&m AG,"Zürich, Schweiz",https://stackoverflow.com/jobs/522399
Software Engineering-AI-Machine Learning,"JPMorgan Chase Bank, N.A.","Plano, TX",https://stackoverflow.com/jobs/539701
Software Engineer-Java-Python,"JPMorgan Chase Bank, N.A.","Plano, TX",https://stackoverflow.com/jobs/539700
Infrastructure Developer - Python,"JPMorgan Chase Bank, N.A.","Houston, TX",https://stackoverflow.com/jobs/539694
Java Software Engineer - Cloud,"JPMorgan Chase Bank, N.A.","Glasgow, UK",https://stackoverflow.com/jobs/539693
"Mid/Senior Level Software Developer - Architecture, Data, & Engineering","JPMorgan Chase Bank, N.A.","Columbus, OH",https://stackoverflow.com/jobs/539680
Cloud Delivery Manager,"JPMorgan Chase Bank, N.A.","Columbus, OH",https://stackoverflow.com/jobs/539678
Senior Python Engineer - Precious Metals Technology Team Lead - Vice President,"JPMorgan Chase Bank, N.A.","London, UK",https://stackoverflow.com/jobs/539674
"Site Reliability Engineer (SRE), Global Private Bank Operations and Client Service...","JPMorgan Chase Bank, N.A.","Jersey City, NJ",https://stackoverflow.com/jobs/539670
Java/ReactJS Software Engineer,"JPMorgan Chase Bank, N.A.","Houston, TX",https://stackoverflow.com/jobs/539663
CIB Investment Bank - Applied AI & Machine Learning - Executive Director,"JPMorgan Chase Bank, N.A.","London, UK",https://stackoverflow.com/jobs/539661
DevOps -Site Reliability Engineer,"JPMorgan Chase Bank, N.A.","Plano, TX",https://stackoverflow.com/jobs/539659
Software Engineer - React,"JPMorgan Chase Bank, N.A.","Glasgow, UK",https://stackoverflow.com/jobs/539658
Java Software Engineer,"JPMorgan Chase Bank, N.A.","Houston, TX",https://stackoverflow.com/jobs/539657
Machine Learning Engineer,"JPMorgan Chase Bank, N.A.","Jersey City, NJ",https://stackoverflow.com/jobs/539656
Cyber Site Reliability Engineer,"JPMorgan Chase Bank, N.A.","Houston, TX",https://stackoverflow.com/jobs/539655
Full Stack Developer,"JPMorgan Chase Bank, N.A.","Jersey City, NJ",https://stackoverflow.com/jobs/539653
Senior Java Developer- Finance Tech,"JPMorgan Chase Bank, N.A.","Wilmington, DE",https://stackoverflow.com/jobs/539651
Java Groovy Software Engineer,"JPMorgan Chase Bank, N.A.","Columbus, OH",https://stackoverflow.com/jobs/539649
Java Software Engineer,"JPMorgan Chase Bank, N.A.","Wilmington, DE",https://stackoverflow.com/jobs/539646
Software Engineer - RSA Archer/SRE,"JPMorgan Chase Bank, N.A.","Columbus, OH",https://stackoverflow.com/jobs/539645
Senior Software Engineer,"JPMorgan Chase Bank, N.A.","Bournemouth, UK",https://stackoverflow.com/jobs/539641
Full Stack Software Engineer,"JPMorgan Chase Bank, N.A.","Houston, TX",https://stackoverflow.com/jobs/539638
Consumer Bank Marketing Data Scientist Lead,"JPMorgan Chase Bank, N.A.","Columbus, OH",https://stackoverflow.com/jobs/539598
Python/Cloud Software Engineer,"JPMorgan Chase Bank, N.A.","Houston, TX",https://stackoverflow.com/jobs/539635
Machine Learning Software Engineer,"JPMorgan Chase Bank, N.A.","Columbus, OH",https://stackoverflow.com/jobs/539630
Python/C++ Software Engineer,"JPMorgan Chase Bank, N.A.","Houston, TX",https://stackoverflow.com/jobs/539624
Data Science Software Engineer,"JPMorgan Chase Bank, N.A.","London, UK",https://stackoverflow.com/jobs/539623
Software Engineer - Data Integration,"JPMorgan Chase Bank, N.A.","Glasgow, UK",https://stackoverflow.com/jobs/539616
Associate Software Engineer,"JPMorgan Chase Bank, N.A.","Wilmington, DE",https://stackoverflow.com/jobs/539614
Software Engineer,"JPMorgan Chase Bank, N.A.","Wilmington, DE",https://stackoverflow.com/jobs/539613
Cloud Software Engineer,"JPMorgan Chase Bank, N.A.","Plano, TX",https://stackoverflow.com/jobs/539611
Technical Representative Software Developer - Java / Code Security - Chief Development...,"JPMorgan Chase Bank, N.A.","Columbus, OH",https://stackoverflow.com/jobs/539610
Full Stack Software Engineer - ESG - AM Research Technology,"JPMorgan Chase Bank, N.A.","London, UK",https://stackoverflow.com/jobs/539605
Athena Risk Developer,"JPMorgan Chase Bank, N.A.","Jersey City, NJ",https://stackoverflow.com/jobs/539604
Technical Lead (Python/C++) Engineer - Realtime Data Services,"JPMorgan Chase Bank, N.A.","Jersey City, NJ",https://stackoverflow.com/jobs/539603
Site Reliability Engineer,"JPMorgan Chase Bank, N.A.","Plano, TX",https://stackoverflow.com/jobs/539596
Software Engineer,"JPMorgan Chase Bank, N.A.","Columbus, OH",https://stackoverflow.com/jobs/539593
Software Engineer - Cloud Security (Kubernetes)- VP,"JPMorgan Chase Bank, N.A.","Plano, TX",https://stackoverflow.com/jobs/539591
Site Reliability Engineer - Java / Production Engineering,"JPMorgan Chase Bank, N.A.","Jersey City, NJ",https://stackoverflow.com/jobs/539589
Database Engineer,ZALORA,"Kuala Lumpur, Malaysia",https://stackoverflow.com/jobs/522390
Lead Core Java Software Engineer,"JPMorgan Chase Bank, N.A.","Columbus, OH",https://stackoverflow.com/jobs/539588
Big Data Cloud Engineer,"JPMorgan Chase Bank, N.A.","Columbus, OH",https://stackoverflow.com/jobs/539585
ETL Software Engineer,"JPMorgan Chase Bank, N.A.","Columbus, OH",https://stackoverflow.com/jobs/539581
Software Engineer,"JPMorgan Chase Bank, N.A.","Chicago, IL",https://stackoverflow.com/jobs/539580
Software Engineer - Kafka Product Engineering,"JPMorgan Chase Bank, N.A.","Jersey City, NJ",https://stackoverflow.com/jobs/539576
Site Reliability Engineer Lead,"JPMorgan Chase Bank, N.A.","Columbus, OH",https://stackoverflow.com/jobs/539575
Site Reliability Engineer,"JPMorgan Chase Bank, N.A.","Columbus, OH",https://stackoverflow.com/jobs/539574
"Vice President, Software Engineer","JPMorgan Chase Bank, N.A.","Jersey City, NJ",https://stackoverflow.com/jobs/539558
Cloud Engineer / Solutions Architect,"JPMorgan Chase Bank, N.A.","Plano, TX",https://stackoverflow.com/jobs/539570
Senior AI Software Engineer,"JPMorgan Chase Bank, N.A.","Jersey City, NJ",https://stackoverflow.com/jobs/539565
AI Software Engineer,"JPMorgan Chase Bank, N.A.","Jersey City, NJ",https://stackoverflow.com/jobs/539564
Lead Data Architect - Java/Cloud,"JPMorgan Chase Bank, N.A.","Houston, TX",https://stackoverflow.com/jobs/539563
Software Engineering JAVA Full Stack,"JPMorgan Chase Bank, N.A.","Plano, TX",https://stackoverflow.com/jobs/539554
CIB Macro Machine Learning Engineer,"JPMorgan Chase Bank, N.A.","London, UK",https://stackoverflow.com/jobs/539549
Java / Python Software Engineer - Equites Algo Trading - VP,"JPMorgan Chase Bank, N.A.","London, UK",https://stackoverflow.com/jobs/539544
C++ Software Engineer - Liquidity - Vice President,"JPMorgan Chase Bank, N.A.","London, UK",https://stackoverflow.com/jobs/539543
Backend Engineer,Tessian,"London, UK",https://stackoverflow.com/jobs/539536
Senior Backend Engineer,Tessian,"London, UK",https://stackoverflow.com/jobs/539535
Principal Solutions Architect,Temporal Technologies,No office location,https://stackoverflow.com/jobs/528913
Principal Engineer - Rust,Temporal Technologies,No office location,https://stackoverflow.com/jobs/528914
Senior Software Developer,Susco,"Metairie, LA",https://stackoverflow.com/jobs/539532
Senior Windows Systems Engineer,Rockstar Games,"New York, NY",https://stackoverflow.com/jobs/522087
Associate Field Software Engineer - Americas,Canonical,No office location,https://stackoverflow.com/jobs/470813
DevOps Engineer,Bitso,No office location,https://stackoverflow.com/jobs/539525
Cloud Technology Engineer,Basware,"Iași, Romania",https://stackoverflow.com/jobs/522364
"Senior Software Engineer, Full Stack",Capital One Financial Corporation,"Plano, TX",https://stackoverflow.com/jobs/539520
Senior Machine Learning Engineer,Capital One Financial Corporation,"McLean, VA",https://stackoverflow.com/jobs/539519
"Software Engineer, Full Stack",Capital One Financial Corporation,"McLean, VA",https://stackoverflow.com/jobs/539518
"Senior Software Engineer, Full Stack",Capital One Financial Corporation,"McLean, VA",https://stackoverflow.com/jobs/539517
"Software Engineer, Full Stack",Capital One Financial Corporation,"Richmond, VA",https://stackoverflow.com/jobs/539516
Software Engineer in Test II,Flashpoint,No office location,https://stackoverflow.com/jobs/525627
Web Engineer,DMGT,"New York, NY",https://stackoverflow.com/jobs/539514
"Manager Site Reliability Engineering (SRE), Apple Cloud Services",Apple,"Cupertino, CA",https://stackoverflow.com/jobs/416436
Software Engineer,Koffie Labs,"Toronto, ON, Canada",https://stackoverflow.com/jobs/539510
Cyber Mitigations Engineer/System Vulnerability Analyst - Entry to Experienced,National Security Agency,"Fort Meade, MD",https://stackoverflow.com/jobs/539509
Python developer for VoIP service provider,TelSmart,"Zagreb, Croatia",https://stackoverflow.com/jobs/435753
Junior DevOps Engineer,CitNOW Video,"Stirling, UK",https://stackoverflow.com/jobs/528895
Senior Full Stack Developer,OnCall Health,"Toronto, ON, Canada",https://stackoverflow.com/jobs/522342
Python/Django Developer (Remote),Soshace LLC,No office location,https://stackoverflow.com/jobs/539487
Node.js Developer (Remote),Soshace LLC,No office location,https://stackoverflow.com/jobs/539488
React.js Developer (Remote),Soshace LLC,No office location,https://stackoverflow.com/jobs/539486
"Cloud Engineer (Azure, Google Cloud Platform, AWS)",ti&m AG,"Bern, Schweiz",https://stackoverflow.com/jobs/522337
Cloud Data Architect mit Flair für AI,ti&m AG,"Bern, Schweiz",https://stackoverflow.com/jobs/522336
"Machine Learning Manager, Modeling",Flock Safety,No office location,https://stackoverflow.com/jobs/539499
Data Engineer,Huxley Banking & Financial ServicesviaHuxley (US),"Chicago, IL",https://stackoverflow.com/jobs/525601
Sr. Software Engineer,eBay,"Netanya, Israel",https://stackoverflow.com/jobs/525600
Senior Cloud Solutions Engineer,DornerWorks,No office location,https://stackoverflow.com/jobs/526642
Senior Data Engineer,eBay Classifieds Group,"Amsterdam, Netherlands",https://stackoverflow.com/jobs/528887
Information Security Developer,Computer FuturesviaComputer Futures US,"Alpharetta, GA",https://stackoverflow.com/jobs/525586
Information Security Engineer,eBay Classifieds Group,"Amsterdam, Netherlands",https://stackoverflow.com/jobs/528884
Software Engineer,ComplyAdvantage,"London, UK",https://stackoverflow.com/jobs/527835
Senior Information Security Analyst- 1 year Contract - Remote,Tucows,No office location,https://stackoverflow.com/jobs/522324
"Senior Platform Software Engineer - Data Streams(Flink, Kafka, Beam, Kubernetes)",Yelp,"London, UK",https://stackoverflow.com/jobs/488024
"Cloud Engineer (Azure, Google Cloud Platform, AWS)",ti&m AG,"Zürich, Schweiz",https://stackoverflow.com/jobs/522303
"Sr. Data Scientist, Wallet, Payments, & Commerce - Raleigh",Apple,"Raleigh, NC",https://stackoverflow.com/jobs/539485
"Site Reliability Engineer (SRE), Apple Cloud Services",Apple,"Austin, TX",https://stackoverflow.com/jobs/527764
"Site Reliability Engineer (SRE), Apple Cloud Services.",Apple,"Cupertino, CA",https://stackoverflow.com/jobs/529457
"Full Stack Software Engineer - Apple Media Products, Apps",Apple,"Cupertino, CA",https://stackoverflow.com/jobs/461351
"ISE, Input Experience - NLP Data & Machine Learning Engineer",Apple,"Cupertino, CA",https://stackoverflow.com/jobs/522125
"AI/ML- Machine Learning Engineer, Information Intelligence",Apple,"Seattle, WA",https://stackoverflow.com/jobs/530096
RAD BI Developer,Apple,Singapore,https://stackoverflow.com/jobs/518117
Data Scientist,Apple,Singapore,https://stackoverflow.com/jobs/538349
"AI/ML - Machine Learning Engineer (Speech Translation), Machine Translation",Apple,"Beijing, China",https://stackoverflow.com/jobs/537870
Senior Software Engineer (Global Business Intelligence ),Apple,Singapore,https://stackoverflow.com/jobs/529810
"SWE - Software Build Engineer, L&RE",Apple,"London, UK",https://stackoverflow.com/jobs/535521
Apple Cloud Services - Site Reliability Engineering Manager (SRE),Apple,"London, UK",https://stackoverflow.com/jobs/534244
"SWE - Cellular Protocol Development Engineer, WTE",Apple,"Munich, Germany",https://stackoverflow.com/jobs/527786
Apple Media Products (AMP) - QA Automation Engineer,Apple,"London, UK",https://stackoverflow.com/jobs/523252
Site Reliability Engineer - Ad Platforms,Apple,"Hyderabad, India",https://stackoverflow.com/jobs/539482
Retail Fulfilment Data Scientist,Apple,"Cork, Ireland",https://stackoverflow.com/jobs/539214
Lead Cellular Systems Analysis Engineer,Apple,"Bengaluru, India",https://stackoverflow.com/jobs/535747
Apple Media Products Engineering (AMP) - Service Reliability Engineer (SRE)- Manager - Analytics & Big Data,Apple,"London, UK",https://stackoverflow.com/jobs/539480
Site Leader - ACS SRE India,Apple,"Bengaluru, India",https://stackoverflow.com/jobs/529474
Head of AI (f/m/d),PAIR Finance GmbH,"Berlin, Deutschland",https://stackoverflow.com/jobs/539478
Senior Java Engineer,Siemens AG,"Tel Aviv-Yafo, Israel",https://stackoverflow.com/jobs/539474
Research Engineer - Vehicle Dynamics,Siemens AG,"Leuven, Belgium",https://stackoverflow.com/jobs/539009
Software Developer - Python -SISW - 254608*,Siemens AG,"Saskatoon, SK, Canada",https://stackoverflow.com/jobs/539472
Systemtester (w/m/d) für Railigent® Applikationen,Siemens AG,"Erlangen, Germany",https://stackoverflow.com/jobs/539470
Experienced Data Engineer,Accenture Romania,"Bucharest, Romania",https://stackoverflow.com/jobs/525561
Full Stack Developer (FE),Apple,"Bengaluru, India",https://stackoverflow.com/jobs/533401
Analytics Program Manager- Media Services Program Management,Apple,"Seattle, WA",https://stackoverflow.com/jobs/529642
Senior Software QA Engineer Apple Media Products.,Apple,"New York, NY",https://stackoverflow.com/jobs/531099
Camera Algorithms Engineer,Apple,"Cambridge, UK",https://stackoverflow.com/jobs/530777
Software Development Engineer in Test,Apple,"Cupertino, CA",https://stackoverflow.com/jobs/531505
"Machine Learning Infrastructure Engineer, Input and Interaction",Apple,"Cupertino, CA",https://stackoverflow.com/jobs/531097
Sr. Systems Administrator - Global Infrastructure Operations,Apple,"Sacramento, CA",https://stackoverflow.com/jobs/530363
"ISE, SIML - Researcher in Scene Understanding (SUN)",Apple,"Cupertino, CA",https://stackoverflow.com/jobs/534238
Data Compliance Engineer (Cloud),Apple,"Austin, TX",https://stackoverflow.com/jobs/522286
Maps Evaluation Performance Engineer,Apple,"Cupertino, CA",https://stackoverflow.com/jobs/527678
Software Test Automation Engineer,Apple,"Cupertino, CA",https://stackoverflow.com/jobs/529643
"AI/ML - Machine Learning Researcher, Machine Intelligence Neural Design",Apple,"Seattle, WA",https://stackoverflow.com/jobs/390738
Cloud Platform (AWS) Software Engineer,Apple,"Austin, TX",https://stackoverflow.com/jobs/536795
"AI/ML - Data Engineer, Siri Search, Knowledge & Platform",Apple,"Seattle, WA",https://stackoverflow.com/jobs/498141
QA Tools and Automation Engineer - Apple Cloud,Apple,"Cupertino, CA",https://stackoverflow.com/jobs/518562
Software Quality Engineer - Retail Online Stores,Apple,"Cupertino, CA",https://stackoverflow.com/jobs/539464
Software Engineer - Data Platform,Apple,"Beijing, China",https://stackoverflow.com/jobs/531522
Linux Engineer,Apple,Singapore,https://stackoverflow.com/jobs/529487
MSI Full-Stack Software Developer,Apple,"Shanghai, China",https://stackoverflow.com/jobs/539463
MSI Full-Stack Software Developer,Apple,"Shanghai, China",https://stackoverflow.com/jobs/539462
Software Engineer (Python) - Supply Chain Systems,Apple,"Hyderabad, India",https://stackoverflow.com/jobs/333370
Sr. Software Engineer - Data Platform,Apple,"Hyderabad, India",https://stackoverflow.com/jobs/533704
Senior Cyber Security Analyst,Apple,"London, UK",https://stackoverflow.com/jobs/537867
Business Analytics - Full Stack Engineer,Apple,"Cork, Ireland",https://stackoverflow.com/jobs/539456
Data Platforms Engineer - Wallet & Apple Pay,Apple,"Hyderabad, India",https://stackoverflow.com/jobs/503496
Business Systems and Data Analyst,Apple,"Austin, TX",https://stackoverflow.com/jobs/522138
"Senior Data Platform Solutions Architect, Ad Platforms",Apple,"Austin, TX",https://stackoverflow.com/jobs/534219
Software Developer in Test - Core I/O and Sensors,Apple,"Cupertino, CA",https://stackoverflow.com/jobs/530963
"AI/ML - Sr Search Data Engineer, Siri Data",Apple,"Seattle, WA",https://stackoverflow.com/jobs/526009
"AI/ML - Creative Producer for Voice (French), Siri Understanding",Apple,"Culver City, CA",https://stackoverflow.com/jobs/526540
"Data Science Manager, Ad Platforms",Apple,"Cupertino, CA",https://stackoverflow.com/jobs/535729
SPG Sensors Software - Sensors Core Stack,Apple,"Cupertino, CA",https://stackoverflow.com/jobs/525066
Machine Learning Engineer - Apple Retail Online,Apple,"Cupertino, CA",https://stackoverflow.com/jobs/535291
"AI/ML - Machine Learning Engineer, Siri Understanding (Private Learning)",Apple,"Seattle, WA",https://stackoverflow.com/jobs/536055
Machine Learning Scientist - Ad Platforms,Apple,"Cupertino, CA",https://stackoverflow.com/jobs/536275
Health Software Automation Engineer,Apple,"Cupertino, CA",https://stackoverflow.com/jobs/537415
Software Engineer in Test (SDET),Apple,"Cupertino, CA",https://stackoverflow.com/jobs/368426
"User Acceptance Specialist, Apple Services - Growth Marketing",Apple,"Culver City, CA",https://stackoverflow.com/jobs/539454
"AI/ML - Sr Data Engineer, Siri Data",Apple,"Cupertino, CA",https://stackoverflow.com/jobs/537420
Full Stack Engineer - Internal Tools,Apple,"San Diego, CA",https://stackoverflow.com/jobs/538111
Senior Software Engineer (Full-stack),Parenthetic,No office location,https://stackoverflow.com/jobs/539449
"DevOps / SRE (Remote, Canada)",Platform.sh,No office location,https://stackoverflow.com/jobs/525493
"Cloud Support Engineer (Remote, New Zealand)",Platform.sh,No office location,https://stackoverflow.com/jobs/525490
Senior Python Developer Remote (f/m/d),Ambient,No office location,https://stackoverflow.com/jobs/493874
(Senior) Systems Engineer im DevOps-Umfeld (m/w/d) in München,jambit GmbH,"München, Deutschland",https://stackoverflow.com/jobs/483475
(Senior) DevOps Engineer (m/w/d) in Leipzig,jambit GmbH,"Leipzig, Deutschland",https://stackoverflow.com/jobs/455001
Full Stack Developer (m/f/d),PAYBACK,"Köln, Deutschland",https://stackoverflow.com/jobs/528865
Data Engineer,Harlem Next,"Haarlem, Netherlands",https://stackoverflow.com/jobs/522218
DevOps Engineer to Battle Censorship Worldwide,"Brave New Software Project, Inc.",No office location,https://stackoverflow.com/jobs/515715
Bioinformatician/Scientific Programmer,European Bioinformatics Institute (EMBL-EBI),"Hinxton, UK",https://stackoverflow.com/jobs/528862
Engineering Experience Software Engineer (Remote),Hotjar,No office location,https://stackoverflow.com/jobs/528857
Senior Data Engineer (Remote),Hotjar,No office location,https://stackoverflow.com/jobs/528856
Software Engineer,StaircaseviaFlexhire,No office location,https://stackoverflow.com/jobs/517300
Linux System and DevOps Engineer - Team Storage (f/m/d),IONOS SE,"Berlin, Deutschland",https://stackoverflow.com/jobs/525475
Senior Software Engineer for CPU Core,Intel Corporation,"Haifa, Israel",https://stackoverflow.com/jobs/532551
"Senior Developer for Cloud Technologies (Kafka, Flink, Terraform)",reeeliance IM GmbH,"Hamburg, Deutschland",https://stackoverflow.com/jobs/517848
System Engineer (f/m/d) Kubernetes,ADITION technologies AG,"Freiburg im Breisgau, Deutschland",https://stackoverflow.com/jobs/525462
"Junior Developer for Cloud Technologies (Kafka, Flink, Terraform)",reeeliance IM GmbH,"Hamburg, Deutschland",https://stackoverflow.com/jobs/516858
Senior Data Engineer (m/f/d),medpex Versandapotheke,"Berlin, Deutschland",https://stackoverflow.com/jobs/525463
DevOps Engineer,Ultra Tendency,No office location,https://stackoverflow.com/jobs/524617
Cloud Engineer (Professional/ Senior),Ultra Tendency,"Berlin, Deutschland",https://stackoverflow.com/jobs/539437
Software Developer: Java/Scala/Spring-Framework,"JPMorgan Chase Bank, N.A.","Jersey City, NJ",https://stackoverflow.com/jobs/539429
Software Engineering-Technology Delivery-JAVA,"JPMorgan Chase Bank, N.A.","Wilmington, DE",https://stackoverflow.com/jobs/539426
Software Engineer - Python Javascript,"JPMorgan Chase Bank, N.A.","Houston, TX",https://stackoverflow.com/jobs/539423
Consumer & Community Banking - Card Risk Machine Learning - VP,"JPMorgan Chase Bank, N.A.","Wilmington, DE",https://stackoverflow.com/jobs/539422
Site Reliability Engineer,"JPMorgan Chase Bank, N.A.","Plano, TX",https://stackoverflow.com/jobs/539421
Full-Stack Software Engineer (VP/Assoc) - Athena Applied Intelligence,"JPMorgan Chase Bank, N.A.","London, UK",https://stackoverflow.com/jobs/539418
Associate-Site Reliability Engineer,"JPMorgan Chase Bank, N.A.","Jersey City, NJ",https://stackoverflow.com/jobs/539415
Python Software Engineer- Risk & Forecasting Solutions,"JPMorgan Chase Bank, N.A.","Houston, TX",https://stackoverflow.com/jobs/539406
"Technical Learning Lead, Software Engineer Program","JPMorgan Chase Bank, N.A.","Columbus, OH",https://stackoverflow.com/jobs/539402
Cloud Software Engineer,"JPMorgan Chase Bank, N.A.","Houston, TX",https://stackoverflow.com/jobs/539401
Python Software Engineer (Cloud/Data Science),"JPMorgan Chase Bank, N.A.","Houston, TX",https://stackoverflow.com/jobs/539397
Senior Applied Data Scientist/AI Lead - Athena Applied Intelligence - London,"JPMorgan Chase Bank, N.A.","London, UK",https://stackoverflow.com/jobs/539394
Python/Django Developer - Corporate Sector | CCB Finance Technology,"JPMorgan Chase Bank, N.A.","Plano, TX",https://stackoverflow.com/jobs/539378
Software Engineering - SRE (Site Reliability Engineer) Lead,"JPMorgan Chase Bank, N.A.","Wilmington, DE",https://stackoverflow.com/jobs/539374
Java Software Engineer - Cloud Data Distribution,"JPMorgan Chase Bank, N.A.","Glasgow, UK",https://stackoverflow.com/jobs/539372
Infrastructure Development - Python - Kubernetes,"JPMorgan Chase Bank, N.A.","London, UK",https://stackoverflow.com/jobs/539368
Site Reliability Engineer Director - Card Services,"JPMorgan Chase Bank, N.A.","Columbus, OH",https://stackoverflow.com/jobs/539363
Software Engineer,"JPMorgan Chase Bank, N.A.","Jersey City, NJ",https://stackoverflow.com/jobs/539302
Site Reliability Engineer,"JPMorgan Chase Bank, N.A.","Chicago, IL",https://stackoverflow.com/jobs/539359
Python Software Engineer,"JPMorgan Chase Bank, N.A.","London, UK",https://stackoverflow.com/jobs/539358
Blockchain DevOps Engineer | Spinnaker+Terraform,"JPMorgan Chase Bank, N.A.","London, UK",https://stackoverflow.com/jobs/539351
Cybersecurity Intelligence Group - Senior Threat Intelligence Developer,"JPMorgan Chase Bank, N.A.","Plano, TX",https://stackoverflow.com/jobs/539350
Machine Learning Engineer for CIB Macro,"JPMorgan Chase Bank, N.A.","Jersey City, NJ",https://stackoverflow.com/jobs/539348
Lead Java Software Engineer,"JPMorgan Chase Bank, N.A.","Columbus, OH",https://stackoverflow.com/jobs/539347
Software Development Engineer in Test,Intel Corporation,"Bengaluru, India",https://stackoverflow.com/jobs/539336
Senior Software Engineer (Python),"JPMorgan Chase Bank, N.A.","Jersey City, NJ",https://stackoverflow.com/jobs/539334
"Software Engineer (C++, Linux/Windows)","JPMorgan Chase Bank, N.A.","Houston, TX",https://stackoverflow.com/jobs/539333
Software Engineer,"JPMorgan Chase Bank, N.A.","Columbus, OH",https://stackoverflow.com/jobs/539329
Site Reliability Engineer,"JPMorgan Chase Bank, N.A.","Columbus, OH",https://stackoverflow.com/jobs/539324
Java Software Engineer,"JPMorgan Chase Bank, N.A.","Plano, TX",https://stackoverflow.com/jobs/539317
Senior Cloud Architect/Engineer - Big Data and Machine Learning,"JPMorgan Chase Bank, N.A.","Wilmington, DE",https://stackoverflow.com/jobs/539316
Cloud Solutions Software Engineer,"JPMorgan Chase Bank, N.A.","Glasgow, UK",https://stackoverflow.com/jobs/539307
Senior Full Stack Software Engineer - ESG - AM Research Technology,"JPMorgan Chase Bank, N.A.","London, UK",https://stackoverflow.com/jobs/539304
Senior Software Engineer,Intel Corporation,"Bengaluru, India",https://stackoverflow.com/jobs/539300
Edge AI Deep Learning Validation Engineer,Intel Corporation,"Bengaluru, India",https://stackoverflow.com/jobs/539297
Software DevOps Engineer,Intel Corporation,"Bengaluru, India",https://stackoverflow.com/jobs/539296
Full Stack Lead/Architect (Sr. Deep Learning R and D Engineer),Intel Corporation,"Bengaluru, India",https://stackoverflow.com/jobs/539294
Graphics SRIOV Virtualization Developer,Intel Corporation,"Bengaluru, India",https://stackoverflow.com/jobs/539293
Python Software Engineer,Captivation Software,"Fort Meade, MD",https://stackoverflow.com/jobs/525426
Sr. Cloud Desktop Engineer (MS Azure/WVD),MUFG,"Charlotte, NC",https://stackoverflow.com/jobs/528824
Software Engineer,Real StaffingviaReal Staffing US,"Irvine, CA",https://stackoverflow.com/jobs/525444
Senior Software Developer In Test,Jelli,"Boise, ID",https://stackoverflow.com/jobs/510883
C++ Software Engineer,"Old Mission Capital, LLC","Chicago, IL",https://stackoverflow.com/jobs/528806
Senior Software Developer In Test,Jelli,"San Mateo, CA",https://stackoverflow.com/jobs/510882
"Manager, Data Engineering",Capital One Financial Corporation,"Plano, TX",https://stackoverflow.com/jobs/539288
Vice President of Machine Learning,Advent Health Partners,No office location,https://stackoverflow.com/jobs/539287
Senior Site Reliability Engineer (DevOps),REPAY,"Tempe, AZ",https://stackoverflow.com/jobs/493259
DevSecOps Engineer,Coqui Health,"San Juan, Puerto Rico",https://stackoverflow.com/jobs/525437
